{
  "schemaVersion": 2,
  "contractVersion": "codex-protocol-vector-suite-v2",
  "protocol": "smart-turn-protocol-v2",
  "positiveCases": [
    {
      "name": "issue-turn-binding-request", "method": "issue_turn_binding", "direction": "request",
      "message": {
        "messageType": "request", "protocolVersion": 2, "release": "0.2.0",
        "requestId": "strq2_aaaaaaaaaaaaaaaaaaaaaaaaaaaaaaaa",
        "owner": {"shellSessionId": "shell-1", "sessionId": "session-1", "turnId": "turn-1", "ownerFingerprint": "aaaaaaaaaaaaaaaaaaaaaaaaaaaaaaaaaaaaaaaaaaaaaaaaaaaaaaaaaaaaaaaa"},
        "turnBinding": null, "idempotencyKey": "idem2_aaaaaaaaaaaaaaaaaaaaaaaaaaaaaaaa",
        "requestDeadlineAt": "2026-07-18T12:00:05Z", "method": "issue_turn_binding",
        "params": {"requestContext": {"schemaVersion": 2, "shellSessionId": "shell-1", "sessionId": "session-1", "turnId": "turn-1", "codexHome": "/Users/test/.codex", "repoRoot": "/Users/test/repo", "baseSha": "bbbbbbbbbbbbbbbbbbbbbbbbbbbbbbbbbbbbbbbbbbbbbbbbbbbbbbbbbbbbbbbb", "worktreeFingerprint": "cccccccccccccccccccccccccccccccccccccccccccccccccccccccccccccccc", "activationFingerprint": "dddddddddddddddddddddddddddddddddddddddddddddddddddddddddddddddd", "compatibilityFingerprint": "eeeeeeeeeeeeeeeeeeeeeeeeeeeeeeeeeeeeeeeeeeeeeeeeeeeeeeeeeeeeeeee", "issuedControlEpoch": 13}, "ttlSeconds": 120},
        "requestFingerprint": "1111111111111111111111111111111111111111111111111111111111111111", "extensions": {}
      }
    },
    {
      "name": "issue-turn-binding-response", "method": "issue_turn_binding", "direction": "response",
      "message": {
        "messageType": "response", "protocolVersion": 2, "release": "0.2.0", "requestId": "strq2_aaaaaaaaaaaaaaaaaaaaaaaaaaaaaaaa",
        "owner": {"shellSessionId": "shell-1", "sessionId": "session-1", "turnId": "turn-1", "ownerFingerprint": "aaaaaaaaaaaaaaaaaaaaaaaaaaaaaaaaaaaaaaaaaaaaaaaaaaaaaaaaaaaaaaaa"},
        "method": "issue_turn_binding", "responseKind": "SUCCESS",
        "requestFingerprint": "1111111111111111111111111111111111111111111111111111111111111111",
        "payload": {"status": "ISSUED", "turnBinding": {"bindingId": "tb2_aaaaaaaaaaaaaaaaaaaaaaaaaaaaaaaa", "owner": {"shellSessionId": "shell-1", "sessionId": "session-1", "turnId": "turn-1", "ownerFingerprint": "aaaaaaaaaaaaaaaaaaaaaaaaaaaaaaaaaaaaaaaaaaaaaaaaaaaaaaaaaaaaaaaa"}, "contextFingerprint": "ffffffffffffffffffffffffffffffffffffffffffffffffffffffffffffffff", "issuedControlEpoch": 13, "issuedAt": "2026-07-18T12:00:00Z", "expiresAt": "2026-07-18T12:02:00Z", "state": "ACTIVE"},
          "effect": {"operation": "TRANSITION", "transactionMode": "BEGIN_IMMEDIATE", "transitions": [{"table": "turn_bindings", "entityId": "tb2_aaaaaaaaaaaaaaaaaaaaaaaaaaaaaaaa", "beforeState": null, "afterState": "ACTIVE"}], "completedAt": "2026-07-18T12:00:00Z", "result": {"resultKind": "TURN_BINDING", "resultId": "tb2_aaaaaaaaaaaaaaaaaaaaaaaaaaaaaaaa", "resultFingerprint": "1212121212121212121212121212121212121212121212121212121212121212"}}},
        "responseFingerprint": "2222222222222222222222222222222222222222222222222222222222222222", "extensions": {}
      }
    },
    {
      "name": "smart-plan-request", "method": "smart_plan", "direction": "request",
      "message": {
        "messageType": "request", "protocolVersion": 2, "release": "0.2.0", "requestId": "strq2_bbbbbbbbbbbbbbbbbbbbbbbbbbbbbbbb",
        "owner": {"shellSessionId": "shell-1", "sessionId": "session-1", "turnId": "turn-1", "ownerFingerprint": "aaaaaaaaaaaaaaaaaaaaaaaaaaaaaaaaaaaaaaaaaaaaaaaaaaaaaaaaaaaaaaaa"},
        "turnBinding": {"bindingId": "tb2_aaaaaaaaaaaaaaaaaaaaaaaaaaaaaaaa", "owner": {"shellSessionId": "shell-1", "sessionId": "session-1", "turnId": "turn-1", "ownerFingerprint": "aaaaaaaaaaaaaaaaaaaaaaaaaaaaaaaaaaaaaaaaaaaaaaaaaaaaaaaaaaaaaaaa"}, "contextFingerprint": "ffffffffffffffffffffffffffffffffffffffffffffffffffffffffffffffff", "issuedControlEpoch": 13, "issuedAt": "2026-07-18T12:00:00Z", "expiresAt": "2026-07-18T12:02:00Z", "state": "ACTIVE"},
        "idempotencyKey": "idem2_bbbbbbbbbbbbbbbbbbbbbbbbbbbbbbbb", "requestDeadlineAt": "2026-07-18T12:00:05Z", "method": "smart_plan",
        "params": {"nodes": [{"clientNodeId": "reader_a", "dependencyIds": [], "routingInput": {
          "taskFacts": {"taskText": "Проверить два независимых файла.", "evidence": [{"evidenceRefId": "request", "kind": "user-request", "statement": "Нужна проверка двух файлов.", "sha256": "aaaaaaaaaaaaaaaaaaaaaaaaaaaaaaaaaaaaaaaaaaaaaaaaaaaaaaaaaaaaaaaa"}], "workShape": {"scopeUnits": {"value": 2, "evidenceRefIds": ["request"]}, "workUnits": {"value": 2, "evidenceRefIds": ["request"]}, "boundaries": {"value": 1, "evidenceRefIds": ["request"]}, "workstreams": {"value": 2, "evidenceRefIds": ["request"]}}, "factorClaims": {"q": {}, "v": {}, "o": {}}, "delegation": {"objectivelyVerifiable": {"value": true, "evidenceRefIds": ["request"]}, "independentWorkUnits": {"value": 2, "evidenceRefIds": ["request"]}}, "hardFloorReasons": [], "hardBanReasons": []},
          "contextBundle": {"schemaVersion": 1, "contractVersion": "codex-context-bundle-v1", "bundleId": "bundle-one", "maxBytes": 64, "totalBytes": 4, "entries": [{"contextRefId": "request", "kind": "task-request", "required": true, "sourceEvidenceRefs": [{"evidenceRefId": "request", "evidenceSha256": "aaaaaaaaaaaaaaaaaaaaaaaaaaaaaaaaaaaaaaaaaaaaaaaaaaaaaaaaaaaaaaaa"}], "sha256": "0ebb429fa86d481c2630fac53db1c91cffed5d4d41d1021c179444eb67e7ee0b", "byteLength": 4, "content": "task"}]}, "roleTemplateId": "researcher-v1"}}]},
        "requestFingerprint": "3333333333333333333333333333333333333333333333333333333333333333", "extensions": {}
      }
    },
    {
      "name": "smart-plan-response", "method": "smart_plan", "direction": "response",
      "message": {
        "messageType": "response", "protocolVersion": 2, "release": "0.2.0", "requestId": "strq2_bbbbbbbbbbbbbbbbbbbbbbbbbbbbbbbb",
        "owner": {"shellSessionId": "shell-1", "sessionId": "session-1", "turnId": "turn-1", "ownerFingerprint": "aaaaaaaaaaaaaaaaaaaaaaaaaaaaaaaaaaaaaaaaaaaaaaaaaaaaaaaaaaaaaaaa"},
        "method": "smart_plan", "responseKind": "SUCCESS", "requestFingerprint": "3333333333333333333333333333333333333333333333333333333333333333",
        "payload": {"status": "PLANNED", "routeId": "route2_aaaaaaaaaaaaaaaaaaaaaaaaaaaaaaaa", "disposition": "DELEGATE", "nodeDecisions": [{"clientNodeId": "reader_a", "nodeId": "node2_aaaaaaaaaaaaaaaaaaaaaaaaaaaaaaaa", "dependencyNodeIds": [], "disposition": "DELEGATE", "selectedPair": {"model": "gpt-5.6-luna", "reasoningEffort": "medium"}, "score": 2, "factors": {"q": 1, "p": 1, "v": 0, "o": 0}}], "clarification": null, "planFingerprint": "4444444444444444444444444444444444444444444444444444444444444444",
          "effect": {"operation": "TRANSITION", "transactionMode": "BEGIN_IMMEDIATE", "transitions": [{"table": "turn_bindings", "entityId": "tb2_aaaaaaaaaaaaaaaaaaaaaaaaaaaaaaaa", "beforeState": "ACTIVE", "afterState": "CONSUMED"}, {"table": "routes", "entityId": "route2_aaaaaaaaaaaaaaaaaaaaaaaaaaaaaaaa", "beforeState": null, "afterState": "PLANNED"}], "completedAt": "2026-07-18T12:00:01Z", "result": {"resultKind": "ROUTE_PLAN", "resultId": "route2_aaaaaaaaaaaaaaaaaaaaaaaaaaaaaaaa", "resultFingerprint": "4444444444444444444444444444444444444444444444444444444444444444"}}},
        "responseFingerprint": "5555555555555555555555555555555555555555555555555555555555555555", "extensions": {}
      }
    },
    {
      "name": "route-start-request", "method": "route_start", "direction": "request",
      "message": {
        "messageType": "request", "protocolVersion": 2, "release": "0.2.0", "requestId": "strq2_cccccccccccccccccccccccccccccccc",
        "owner": {"shellSessionId": "shell-1", "sessionId": "session-1", "turnId": "turn-1", "ownerFingerprint": "aaaaaaaaaaaaaaaaaaaaaaaaaaaaaaaaaaaaaaaaaaaaaaaaaaaaaaaaaaaaaaaa"},
        "turnBinding": null, "idempotencyKey": "idem2_cccccccccccccccccccccccccccccccc", "requestDeadlineAt": "2026-07-18T12:00:07Z", "method": "route_start",
        "params": {"routeId": "route2_aaaaaaaaaaaaaaaaaaaaaaaaaaaaaaaa", "nodeId": "node2_aaaaaaaaaaaaaaaaaaaaaaaaaaaaaaaa",
          "activationGate": {"manifestSemanticFingerprint": "cccccccccccccccccccccccccccccccccccccccccccccccccccccccccccccccc", "activationReceiptFingerprint": "dddddddddddddddddddddddddddddddddddddddddddddddddddddddddddddddd",
            "journalAbsenceProof": {"schemaId": "absence-proof-v2", "schemaSha256": "eeeeeeeeeeeeeeeeeeeeeeeeeeeeeeeeeeeeeeeeeeeeeeeeeeeeeeeeeeeeeeee", "value": {"proofId": "ap2_aaaaaaaaaaaaaaaaaaaaaaaaaaaaaaaa", "installationId": "ins2_bbbbbbbbbbbbbbbbbbbbbbbbbbbbbbbb", "operationId": "op2_cccccccccccccccccccccccccccccccc", "entries": [{"path": "/tmp/codex/install.transaction.json", "basename": "install.transaction.json", "parentDevice": 1, "parentInode": 2, "absent": true}], "directorySyncCompleted": true, "proofFingerprint": "ffffffffffffffffffffffffffffffffffffffffffffffffffffffffffffffff"}, "valueFingerprint": "1111111111111111111111111111111111111111111111111111111111111111"},
            "gateFingerprint": "2222222222222222222222222222222222222222222222222222222222222222"}},
        "requestFingerprint": "6666666666666666666666666666666666666666666666666666666666666666", "extensions": {}
      }
    },
    {
      "name": "route-start-response", "method": "route_start", "direction": "response",
      "message": {
        "messageType": "response", "protocolVersion": 2, "release": "0.2.0", "requestId": "strq2_cccccccccccccccccccccccccccccccc",
        "owner": {"shellSessionId": "shell-1", "sessionId": "session-1", "turnId": "turn-1", "ownerFingerprint": "aaaaaaaaaaaaaaaaaaaaaaaaaaaaaaaaaaaaaaaaaaaaaaaaaaaaaaaaaaaaaaaa"},
        "method": "route_start", "responseKind": "SUCCESS", "requestFingerprint": "6666666666666666666666666666666666666666666666666666666666666666",